{
  "$schema": "https://json-schema.org/draft/2020-12/schema",
  "title": "AI Signal Static Analysis Result",
  "type": "object",
  "required": ["schema_version", "sample", "features", "classification", "errors"],
  "allOf": [{"if": {"properties": {"schema_version": {"const": "0.4"}}},
             "then": {"properties": {"features": {"required": ["code_generation_signals", "facts"],
               "properties": {"code_generation_signals": {"required": ["metrics", "style_indicators",
                 "generation_artifacts", "hallucination_candidates", "local_profiles", "fingerprint",
                 "source_hypotheses", "analysis_status"]}}}}}}],
  "properties": {
    "schema_version": {"enum": ["0.1", "0.2", "0.3", "0.4"]},
    "sample": {"type": "object", "required": ["sha256", "size", "file_type", "recoverability"]},
    "features": {
      "type": "object",
      "required": ["toolchain", "prompt", "code_style", "recovery"],
      "properties": {
        "prompt": {
          "type": "object",
          "properties": {
            "compositions": {
              "type": "array",
              "items": {
                "type": "object",
                "required": ["composition_id", "target_call_unit_id", "components", "component_count", "runtime_complete", "completeness"],
                "properties": {
                  "composition_id": {"type": "string"},
                  "target_call_unit_id": {"type": "string"},
                  "components": {"type": "array"},
                  "component_count": {"type": "integer", "minimum": 1},
                  "unknown_component_count": {"type": ["integer", "null"], "minimum": 0},
                  "runtime_complete": {"const": false},
                  "completeness": {"const": "static_components_only"}
                }
              }
            }
          }
        },
        "code_generation_signals": {
          "type": "object",
          "properties": {
            "metrics": {"type": "object"},
            "style_indicators": {"type": "array"},
            "generation_artifacts": {"type": "array"},
            "hallucination_candidates": {"type": "array"},
            "local_profiles": {"type": "array"},
            "fingerprint": {"type": ["object", "null"]},
            "source_hypotheses": {"type": "object"},
            "analysis_status": {"type": "object"},
            "legacy_observations": {"type": "array"}
          }
        },
        "static_analysis": {"type": "object"},
        "facts": {"type": "array"}
      }
    },
    "classification": {"type": "object", "required": ["llm_involvement", "model_attribution"]},
    "errors": {"type": "array"}
  }
}
