{
  "schema_version": "0.1",
  "sample": {
    "sha256": "bdb33bbb4ea11884b15f67e5c974136e6294aa87459cdc276ac2eea85b1deaa3",
    "sha1": "4cf6812ef24341b512ee8e76226a649f0efe4f65",
    "md5": "f72c45b658911ad6f5202de55ba6ed5c",
    "size": 13208102,
    "file_name": "AI_image_generator_v0.95.exe (LAMEHUG)_bdb33bbb4ea11884b15f67e5c974136e6294aa87459cdc276ac2eea85b1deaa3",
    "file_type": "PE32+ executable (console) x86-64, for MS Windows, 7 sections",
    "entropy": 7.9947,
    "language": null,
    "recoverability": "strings_only"
  },
  "features": {
    "toolchain": {
      "source_language": null,
      "file_type": "PE32+ executable (console) x86-64, for MS Windows, 7 sections",
      "packaging_candidates": [
        "PyInstaller"
      ],
      "evidence": [
        {
          "type": "model_identifier",
          "rule_id": "qwen25_coder_32b",
          "value": "Qwen/Qwen2.5-Coder-32B-Instruct",
          "normalized": {
            "vendor": "Alibaba/Qwen",
            "family": "Qwen",
            "model": "Qwen2.5-Coder-32B-Instruct"
          },
          "source": "recovered_pyinstaller:image.pyc:strings:ascii",
          "offset": 14776,
          "confidence": 0.99,
          "evidence_level": "direct",
          "recovery_origin": {
            "layer": "pyinstaller_recovered_entry",
            "entrypoint": "image.pyc",
            "recovered_source_sha256": "a59ba6b806e42dc8cd679055256ee7f9dd68e046558f3cc97b10531dae7d8152"
          }
        },
        {
          "type": "model_identifier",
          "rule_id": "qwen25_coder_32b",
          "value": "Qwen/Qwen2.5-Coder-32B-Instruct",
          "normalized": {
            "vendor": "Alibaba/Qwen",
            "family": "Qwen",
            "model": "Qwen2.5-Coder-32B-Instruct"
          },
          "source": "recovered_pyinstaller:image.pyc:strings:ascii",
          "offset": 15400,
          "confidence": 0.99,
          "evidence_level": "direct",
          "recovery_origin": {
            "layer": "pyinstaller_recovered_entry",
            "entrypoint": "image.pyc",
            "recovered_source_sha256": "a59ba6b806e42dc8cd679055256ee7f9dd68e046558f3cc97b10531dae7d8152"
          }
        },
        {
          "type": "model_identifier",
          "rule_id": "qwen25_coder_32b",
          "value": "Qwen/Qwen2.5-Coder-32B-Instruct",
          "normalized": {
            "vendor": "Alibaba/Qwen",
            "family": "Qwen",
            "model": "Qwen2.5-Coder-32B-Instruct"
          },
          "source": "recovered_pyinstaller:image.pyc:raw_byte_scan",
          "offset": 14794,
          "confidence": 0.99,
          "evidence_level": "direct",
          "recovery_origin": {
            "layer": "pyinstaller_recovered_entry",
            "entrypoint": "image.pyc",
            "recovered_source_sha256": "a59ba6b806e42dc8cd679055256ee7f9dd68e046558f3cc97b10531dae7d8152"
          }
        }
      ]
    },
    "prompt": {
      "embedded_prompts": [
        {
          "offset": 14365,
          "source": "recovered_pyinstaller:image.pyc:strings:ascii",
          "text_hash": "sha256:0d28a92ed736a82ad675537aa0923851d4d4f3a31c69ba316c2be3c3d97b69c9",
          "fuzzy_hash": {
            "algorithm": "simhash64_normalized_tokens_v1",
            "value": "simhash64:471c4f1341b60287",
            "normalization": "unicode_nfkc_lowercase_whitespace_collapse"
          },
          "text_preview": "'content': 'Make a list of commands to create folder C:\\\\Programdata\\\\info and to gather computer information, hardware information, process and services information, networks information, AD domain information, to execute in one line and a",
          "features": {
            "output_only": true
          },
          "recovery_origin": {
            "layer": "pyinstaller_recovered_entry",
            "entrypoint": "image.pyc",
            "recovered_source_sha256": "a59ba6b806e42dc8cd679055256ee7f9dd68e046558f3cc97b10531dae7d8152"
          }
        },
        {
          "offset": 15087,
          "source": "recovered_pyinstaller:image.pyc:strings:ascii",
          "text_hash": "sha256:d2920a605e3de30d142067efc015693818b63c5dbc56d9c1a451a19b252a6df1",
          "fuzzy_hash": {
            "algorithm": "simhash64_normalized_tokens_v1",
            "value": "simhash64:177ccd32c1f39283",
            "normalization": "unicode_nfkc_lowercase_whitespace_collapse"
          },
          "text_preview": "'content': 'Make a list of commands to copy recursively different office and pdf/txt documents in user Documents,Downloads and Desktop folders to a folder c:\\\\Programdata\\\\info\\\\ to execute in one line. Return only command, without markdown",
          "features": {
            "output_only": true,
            "code_only": true
          },
          "recovery_origin": {
            "layer": "pyinstaller_recovered_entry",
            "entrypoint": "image.pyc",
            "recovered_source_sha256": "a59ba6b806e42dc8cd679055256ee7f9dd68e046558f3cc97b10531dae7d8152"
          }
        }
      ],
      "structural_features": {
        "role_definition": false,
        "output_only": true,
        "code_only": true,
        "single_line_command": false,
        "self_modification": false,
        "evasion": false,
        "jailbreak": false,
        "safety_framing": false
      },
      "special_tokens": []
    },
    "code_style": {
      "status": "not_trained",
      "language": null,
      "recoverability": "strings_only",
      "metrics": {},
      "ai_generated_detection": {
        "status": "not_trained",
        "heuristic_score": null
      },
      "recovered_layers": [
        {
          "entrypoint": "image.pyc",
          "recovered_source_sha256": "a59ba6b806e42dc8cd679055256ee7f9dd68e046558f3cc97b10531dae7d8152",
          "analysis": {
            "status": "not_trained",
            "language": "python",
            "recoverability": "recovered_source",
            "metrics": {
              "loc": 440,
              "blank_ratio": 0.034,
              "comment_ratio": 0.725,
              "mean_identifier_length": null,
              "naming_style": {}
            },
            "ai_generated_detection": {
              "status": "not_trained",
              "heuristic_score": null
            },
            "parse_error": "unterminated string literal (detected at line 283) (<unknown>, line 283)"
          }
        }
      ]
    },
    "recovery": {
      "pyinstaller": {
        "status": "recovered",
        "extractor": "pyinstxtractor-ng",
        "decompiler": "pycdc",
        "entrypoint": "image.pyc",
        "recovered_source_sha256": "a59ba6b806e42dc8cd679055256ee7f9dd68e046558f3cc97b10531dae7d8152",
        "recovered_source_size": 19107
      }
    }
  },
  "classification": {
    "llm_involvement": {
      "label": "confirmed",
      "confidence": 0.99
    },
    "model_attribution": {
      "vendor": "Alibaba/Qwen",
      "family": "Qwen",
      "model": "Qwen2.5-Coder-32B-Instruct",
      "decision_method": "direct_model_identifier",
      "confidence": 0.99
    },
    "evidence_summary": [
      {
        "type": "model_identifier",
        "rule_id": "qwen25_coder_32b",
        "value": "Qwen/Qwen2.5-Coder-32B-Instruct",
        "normalized": {
          "vendor": "Alibaba/Qwen",
          "family": "Qwen",
          "model": "Qwen2.5-Coder-32B-Instruct"
        },
        "source": "recovered_pyinstaller:image.pyc:strings:ascii",
        "offset": 14776,
        "confidence": 0.99,
        "evidence_level": "direct",
        "recovery_origin": {
          "layer": "pyinstaller_recovered_entry",
          "entrypoint": "image.pyc",
          "recovered_source_sha256": "a59ba6b806e42dc8cd679055256ee7f9dd68e046558f3cc97b10531dae7d8152"
        }
      }
    ]
  },
  "errors": []
}
