{
  "schema_version": "0.1",
  "sample": {
    "sha256": "0884e5590bdf3763f8529453fbd24ee46a3a460bba4c2da5b0141f5ec6a35675",
    "sha1": "1cc39fefbbc98ef8d4960107b373efd0c6ed6005",
    "md5": "ee5b997a34653f79d8ab1f35403d1a38",
    "size": 6176,
    "file_name": "sample.bin",
    "file_type": "Unicode text, UTF-8 (with BOM) text, with very long lines (349), with CRLF, LF line terminators",
    "entropy": 4.9023,
    "language": "powershell",
    "recoverability": "original_source",
    "source_encoding": "utf-8"
  },
  "features": {
    "toolchain": {
      "source_language": "powershell",
      "file_type": "Unicode text, UTF-8 (with BOM) text, with very long lines (349), with CRLF, LF line terminators",
      "packaging_candidates": [],
      "evidence": []
    },
    "prompt": {
      "embedded_prompts": [],
      "structural_features": {
        "role_definition": false,
        "output_only": false,
        "code_only": false,
        "single_line_command": false,
        "self_modification": false,
        "evasion": false,
        "jailbreak": false,
        "safety_framing": false
      },
      "special_tokens": []
    },
    "code_style": {
      "status": "not_trained",
      "language": "powershell",
      "recoverability": "original_source",
      "metrics": {
        "loc": 188,
        "blank_ratio": 0.16,
        "comment_ratio": 0.07,
        "mean_identifier_length": 6.79,
        "naming_style": {
          "snake_case": 0.013,
          "camel_case": 0.053,
          "other": 0.934
        },
        "function_count": 10
      },
      "ai_generated_detection": {
        "status": "not_trained",
        "heuristic_score": null
      }
    },
    "recovery": {
      "pyinstaller": {
        "status": "not_detected"
      }
    }
  },
  "classification": {
    "llm_involvement": {
      "label": "unknown",
      "confidence": 0.0
    },
    "model_attribution": {
      "vendor": null,
      "family": "unknown",
      "model": null,
      "decision_method": "unknown",
      "confidence": 0.0
    },
    "evidence_summary": []
  },
  "errors": []
}
