{
  "schema_version": "0.1",
  "sample": {
    "sha256": "b49aa9efd41f82b34a7811a7894f0ebf04e1d9aab0b622e0083b78f54fe8b466",
    "sha1": "ec346d99da33ea3c766d8a90281e2cd57ec137b0",
    "md5": "2ae6684e8c5ebc72c2202d5d2d829bb5",
    "size": 375686,
    "file_name": "b49aa9efd41f82b34a7811a7894f0ebf04e1d9aab0b622e0083b78f54fe8b466",
    "file_type": "Byte-compiled Python module for CPython 3.10, timestamp-based, .py timestamp: Thu Jan  1 00:00:00 1970 UTC, .py size: 0 bytes",
    "entropy": 5.9926,
    "language": null,
    "recoverability": "unknown"
  },
  "features": {
    "toolchain": {
      "source_language": null,
      "file_type": "Byte-compiled Python module for CPython 3.10, timestamp-based, .py timestamp: Thu Jan  1 00:00:00 1970 UTC, .py size: 0 bytes",
      "packaging_candidates": [],
      "evidence": [
        {
          "type": "model_identifier",
          "rule_id": "qwen25_coder_32b",
          "value": "Qwen/Qwen2.5-Coder-32B-Instruct",
          "normalized": {
            "vendor": "Alibaba/Qwen",
            "family": "Qwen",
            "model": "Qwen2.5-Coder-32B-Instruct"
          },
          "source": "strings:ascii",
          "offset": 374878,
          "confidence": 0.99,
          "evidence_level": "direct"
        }
      ]
    },
    "prompt": {
      "embedded_prompts": [],
      "structural_features": {
        "role_definition": false,
        "output_only": false,
        "code_only": false,
        "single_line_command": false,
        "self_modification": false,
        "evasion": false,
        "jailbreak": false,
        "safety_framing": false
      },
      "special_tokens": []
    },
    "code_style": {
      "status": "not_trained",
      "language": null,
      "recoverability": "unknown",
      "metrics": {},
      "ai_generated_detection": {
        "status": "not_trained",
        "heuristic_score": null
      }
    },
    "recovery": {
      "pyinstaller": {
        "status": "not_detected"
      }
    }
  },
  "classification": {
    "llm_involvement": {
      "label": "confirmed",
      "confidence": 0.99
    },
    "model_attribution": {
      "vendor": "Alibaba/Qwen",
      "family": "Qwen",
      "model": "Qwen2.5-Coder-32B-Instruct",
      "decision_method": "direct_model_identifier",
      "confidence": 0.99
    },
    "evidence_summary": [
      {
        "type": "model_identifier",
        "rule_id": "qwen25_coder_32b",
        "value": "Qwen/Qwen2.5-Coder-32B-Instruct",
        "normalized": {
          "vendor": "Alibaba/Qwen",
          "family": "Qwen",
          "model": "Qwen2.5-Coder-32B-Instruct"
        },
        "source": "strings:ascii",
        "offset": 374878,
        "confidence": 0.99,
        "evidence_level": "direct"
      }
    ]
  },
  "errors": []
}
