{
  "schema_version": "0.1",
  "sample": {
    "sha256": "4c73717d933f6b53c40ed1b211143df8d011800897be1ceb5d4a2af39c9d4ccc",
    "sha1": "597d9a4fabaf721d7ae34c7860b769dd638bf0ae",
    "md5": "4c164f238340c6bf416df97cc3003336",
    "size": 4009,
    "file_name": "4c73717d933f6b53c40ed1b211143df8d011800897be1ceb5d4a2af39c9d4ccc",
    "file_type": "Unicode text, UTF-8 text, with CRLF line terminators",
    "entropy": 4.8369,
    "language": "python",
    "recoverability": "original_source",
    "source_encoding": "utf-8"
  },
  "features": {
    "toolchain": {
      "source_language": "python",
      "file_type": "Unicode text, UTF-8 text, with CRLF line terminators",
      "packaging_candidates": [],
      "evidence": [
        {
          "type": "model_identifier",
          "rule_id": "openai_gpt_family",
          "value": "gpt-3.5-turbo",
          "normalized": {
            "vendor": "OpenAI",
            "family": "GPT"
          },
          "source": "strings:ascii",
          "offset": 3241,
          "confidence": 0.95,
          "evidence_level": "direct"
        },
        {
          "type": "sdk_marker",
          "rule_id": null,
          "value": "import openai",
          "normalized": {
            "family": "GPT",
            "provider": "OpenAI"
          },
          "source": "strings:ascii",
          "offset": 0,
          "confidence": 0.9,
          "evidence_level": "strong_indirect"
        },
        {
          "type": "sdk_marker",
          "rule_id": null,
          "value": "openai(",
          "normalized": {
            "family": "GPT",
            "provider": "OpenAI"
          },
          "source": "strings:ascii",
          "offset": 3159,
          "confidence": 0.9,
          "evidence_level": "strong_indirect"
        },
        {
          "type": "sdk_marker",
          "rule_id": null,
          "value": "openai(",
          "normalized": {
            "family": "GPT",
            "provider": "OpenAI"
          },
          "source": "strings:ascii",
          "offset": 3541,
          "confidence": 0.9,
          "evidence_level": "strong_indirect"
        },
        {
          "type": "model_identifier",
          "rule_id": "openai_gpt_family",
          "value": "gpt-3.5-turbo",
          "normalized": {
            "vendor": "OpenAI",
            "family": "GPT"
          },
          "source": "raw_byte_scan",
          "offset": 3256,
          "confidence": 0.95,
          "evidence_level": "direct"
        }
      ]
    },
    "prompt": {
      "embedded_prompts": [],
      "structural_features": {
        "role_definition": false,
        "output_only": false,
        "code_only": false,
        "single_line_command": false,
        "self_modification": false,
        "evasion": false,
        "jailbreak": false,
        "safety_framing": false
      },
      "special_tokens": []
    },
    "code_style": {
      "status": "not_trained",
      "language": "python",
      "recoverability": "original_source",
      "metrics": {
        "loc": 103,
        "blank_ratio": 0.243,
        "comment_ratio": 0.026,
        "mean_identifier_length": 7.99,
        "naming_style": {
          "snake_case": 0.361,
          "camel_case": 0.0,
          "other": 0.639
        },
        "function_count": 10,
        "exception_handler_count": 1,
        "exception_handler_ratio": 0.1,
        "ast_node_counts": {
          "Name": 72,
          "Load": 72,
          "Constant": 28,
          "Call": 24,
          "Store": 18,
          "Assign": 17,
          "Return": 12,
          "Attribute": 11,
          "FunctionDef": 10,
          "arguments": 10,
          "arg": 10,
          "Expr": 5,
          "BinOp": 5,
          "If": 4,
          "Add": 4,
          "Subscript": 4,
          "List": 3,
          "keyword": 3,
          "Import": 2,
          "alias": 2
        }
      },
      "ai_generated_detection": {
        "status": "not_trained",
        "heuristic_score": null
      }
    },
    "recovery": {
      "pyinstaller": {
        "status": "not_detected"
      }
    }
  },
  "classification": {
    "llm_involvement": {
      "label": "confirmed",
      "confidence": 0.95
    },
    "model_attribution": {
      "vendor": "OpenAI",
      "family": "GPT",
      "model": "gpt-3.5-turbo",
      "decision_method": "direct_model_identifier",
      "confidence": 0.95
    },
    "evidence_summary": [
      {
        "type": "model_identifier",
        "rule_id": "openai_gpt_family",
        "value": "gpt-3.5-turbo",
        "normalized": {
          "vendor": "OpenAI",
          "family": "GPT"
        },
        "source": "strings:ascii",
        "offset": 3241,
        "confidence": 0.95,
        "evidence_level": "direct"
      }
    ]
  },
  "errors": []
}
