{
  "schema_version": "0.1",
  "sample": {
    "sha256": "c5ae843e1c7769803ca70a9d5b5574870f365fb139016134e5dd3cb1b1a65f5f",
    "sha1": "27406216ed9d5bae4c25f35dda614fca8648d475",
    "md5": "96ce3cc319847200535609e7132bda56",
    "size": 463,
    "file_name": "c5ae843e1c7769803ca70a9d5b5574870f365fb139016134e5dd3cb1b1a65f5f",
    "file_type": "ASCII text, with CRLF line terminators",
    "entropy": 4.2665,
    "language": "python",
    "recoverability": "original_source",
    "source_encoding": "utf-8"
  },
  "features": {
    "toolchain": {
      "source_language": "python",
      "file_type": "ASCII text, with CRLF line terminators",
      "packaging_candidates": [],
      "evidence": []
    },
    "prompt": {
      "embedded_prompts": [],
      "structural_features": {
        "role_definition": false,
        "output_only": false,
        "code_only": false,
        "single_line_command": false,
        "self_modification": false,
        "evasion": false,
        "jailbreak": false,
        "safety_framing": false
      },
      "special_tokens": []
    },
    "code_style": {
      "status": "not_trained",
      "language": "python",
      "recoverability": "original_source",
      "metrics": {
        "loc": 15,
        "blank_ratio": 0.133,
        "comment_ratio": 0.077,
        "mean_identifier_length": 6.33,
        "naming_style": {
          "snake_case": 0.333,
          "camel_case": 0.0,
          "other": 0.667
        },
        "function_count": 1,
        "exception_handler_count": 0,
        "exception_handler_ratio": 0.0,
        "ast_node_counts": {
          "Name": 24,
          "Load": 20,
          "Store": 10,
          "Call": 7,
          "Attribute": 5,
          "Assign": 3,
          "Constant": 3,
          "Import": 2,
          "Expr": 2,
          "alias": 2,
          "For": 2,
          "With": 2,
          "withitem": 2,
          "Module": 1,
          "FunctionDef": 1,
          "arguments": 1,
          "arg": 1,
          "Tuple": 1
        }
      },
      "ai_generated_detection": {
        "status": "not_trained",
        "heuristic_score": null
      }
    },
    "recovery": {
      "pyinstaller": {
        "status": "not_detected"
      }
    }
  },
  "classification": {
    "llm_involvement": {
      "label": "unknown",
      "confidence": 0.0
    },
    "model_attribution": {
      "vendor": null,
      "family": "unknown",
      "model": null,
      "decision_method": "unknown",
      "confidence": 0.0
    },
    "evidence_summary": []
  },
  "errors": []
}
