{
  "schema_version": "0.1",
  "sample": {
    "sha256": "a30930dfb655aa39c571c163ada65ba4dec30600df3bf548cc48bedd0e841416",
    "sha1": "e065bec7855235dedfec5e66392b81b7a2234d0b",
    "md5": "cafe08392d476a057d85de4983bac94e",
    "size": 271041,
    "file_name": "a30930dfb655aa39c571c163ada65ba4dec30600df3bf548cc48bedd0e841416",
    "file_type": "PDF document, version 1.7, 2 page(s)",
    "entropy": 7.8822,
    "language": null,
    "recoverability": "strings_only"
  },
  "features": {
    "toolchain": {
      "source_language": null,
      "file_type": "PDF document, version 1.7, 2 page(s)",
      "packaging_candidates": [],
      "evidence": []
    },
    "prompt": {
      "embedded_prompts": [],
      "structural_features": {
        "role_definition": false,
        "output_only": false,
        "code_only": false,
        "single_line_command": false,
        "self_modification": false,
        "evasion": false,
        "jailbreak": false,
        "safety_framing": false
      },
      "special_tokens": []
    },
    "code_style": {
      "status": "not_trained",
      "language": null,
      "recoverability": "strings_only",
      "metrics": {},
      "ai_generated_detection": {
        "status": "not_trained",
        "heuristic_score": null
      }
    },
    "recovery": {
      "pyinstaller": {
        "status": "not_detected"
      }
    }
  },
  "classification": {
    "llm_involvement": {
      "label": "unknown",
      "confidence": 0.0
    },
    "model_attribution": {
      "vendor": null,
      "family": "unknown",
      "model": null,
      "decision_method": "unknown",
      "confidence": 0.0
    },
    "evidence_summary": []
  },
  "errors": []
}
