{
  "schema_version": "0.1",
  "sample": {
    "sha256": "c1a80983779d8408a9c303d403999a9aef8c2f0fe63f8b5ca658862f66f3db16",
    "sha1": "197f2b453d77ce187d70999a8f2e30d212134e53",
    "md5": "9d92b5436a0e75471de4b583696b33ac",
    "size": 7857,
    "file_name": "c1a80983779d8408a9c303d403999a9aef8c2f0fe63f8b5ca658862f66f3db16",
    "file_type": "ASCII text, with very long lines (474)",
    "entropy": 4.8818,
    "language": "python",
    "recoverability": "original_source",
    "source_encoding": "utf-8"
  },
  "features": {
    "toolchain": {
      "source_language": "python",
      "file_type": "ASCII text, with very long lines (474)",
      "packaging_candidates": [],
      "evidence": [
        {
          "type": "model_identifier",
          "rule_id": "openai_gpt_family",
          "value": "gpt-4",
          "normalized": {
            "vendor": "OpenAI",
            "family": "GPT"
          },
          "source": "strings:ascii",
          "offset": 667,
          "confidence": 0.95,
          "evidence_level": "direct"
        },
        {
          "type": "sdk_marker",
          "rule_id": null,
          "value": "import openai",
          "normalized": {
            "family": "GPT",
            "provider": "OpenAI"
          },
          "source": "strings:ascii",
          "offset": 0,
          "confidence": 0.9,
          "evidence_level": "strong_indirect"
        },
        {
          "type": "model_identifier",
          "rule_id": "openai_gpt_family",
          "value": "gpt-4",
          "normalized": {
            "vendor": "OpenAI",
            "family": "GPT"
          },
          "source": "raw_byte_scan",
          "offset": 730,
          "confidence": 0.95,
          "evidence_level": "direct"
        }
      ]
    },
    "prompt": {
      "embedded_prompts": [],
      "structural_features": {
        "role_definition": false,
        "output_only": false,
        "code_only": false,
        "single_line_command": false,
        "self_modification": false,
        "evasion": false,
        "jailbreak": false,
        "safety_framing": false
      },
      "special_tokens": []
    },
    "code_style": {
      "status": "not_trained",
      "language": "python",
      "recoverability": "original_source",
      "metrics": {
        "loc": 75,
        "blank_ratio": 0.0,
        "comment_ratio": 0.0,
        "mean_identifier_length": 11.66,
        "naming_style": {
          "snake_case": 0.303,
          "camel_case": 0.0,
          "other": 0.697
        },
        "function_count": 6,
        "exception_handler_count": 1,
        "exception_handler_ratio": 0.167,
        "ast_node_counts": {
          "Load": 112,
          "Name": 99,
          "Constant": 63,
          "Call": 48,
          "Attribute": 30,
          "Expr": 26,
          "Store": 23,
          "Assign": 20,
          "Return": 7,
          "FunctionDef": 6,
          "arguments": 6,
          "arg": 6,
          "If": 5,
          "List": 4,
          "Compare": 3,
          "Eq": 3,
          "keyword": 3,
          "alias": 2,
          "For": 2,
          "FormattedValue": 2
        }
      },
      "ai_generated_detection": {
        "status": "not_trained",
        "heuristic_score": null
      }
    },
    "recovery": {
      "pyinstaller": {
        "status": "not_detected"
      }
    }
  },
  "classification": {
    "llm_involvement": {
      "label": "confirmed",
      "confidence": 0.95
    },
    "model_attribution": {
      "vendor": "OpenAI",
      "family": "GPT",
      "model": "gpt-4",
      "decision_method": "direct_model_identifier",
      "confidence": 0.95
    },
    "evidence_summary": [
      {
        "type": "model_identifier",
        "rule_id": "openai_gpt_family",
        "value": "gpt-4",
        "normalized": {
          "vendor": "OpenAI",
          "family": "GPT"
        },
        "source": "strings:ascii",
        "offset": 667,
        "confidence": 0.95,
        "evidence_level": "direct"
      }
    ]
  },
  "errors": []
}
