{
  "schema_version": "0.1",
  "sample": {
    "sha256": "165eaf8183f693f644a8a24d2ec138cd4f8d9fd040e8bafc1b021a0f973692dd",
    "sha1": "2fd096682ccd08134d3af26819bd3af7c0a100fb",
    "md5": "1e8e9235707f24747498ff7223b29083",
    "size": 208,
    "file_name": "165eaf8183f693f644a8a24d2ec138cd4f8d9fd040e8bafc1b021a0f973692dd",
    "file_type": "Unicode text, UTF-8 (with BOM) text, with CRLF line terminators",
    "entropy": 5.0338,
    "language": null,
    "recoverability": "unknown"
  },
  "features": {
    "toolchain": {
      "source_language": null,
      "file_type": "Unicode text, UTF-8 (with BOM) text, with CRLF line terminators",
      "packaging_candidates": [],
      "evidence": []
    },
    "prompt": {
      "embedded_prompts": [],
      "structural_features": {
        "role_definition": false,
        "output_only": false,
        "code_only": false,
        "single_line_command": false,
        "self_modification": false,
        "evasion": false,
        "jailbreak": false,
        "safety_framing": false
      },
      "special_tokens": []
    },
    "code_style": {
      "status": "not_trained",
      "language": null,
      "recoverability": "unknown",
      "metrics": {},
      "ai_generated_detection": {
        "status": "not_trained",
        "heuristic_score": null
      }
    },
    "recovery": {
      "pyinstaller": {
        "status": "not_detected"
      }
    }
  },
  "classification": {
    "llm_involvement": {
      "label": "unknown",
      "confidence": 0.0
    },
    "model_attribution": {
      "vendor": null,
      "family": "unknown",
      "model": null,
      "decision_method": "unknown",
      "confidence": 0.0
    },
    "evidence_summary": []
  },
  "errors": []
}
